{"id":"lex-dominus","lemma_id":"lex-dominus","schema_version":"1.0.0","content_version":"0.1.0","title":"dominus","created_at":"2026-08-25T12:00:00+09:00","updated_at":"2026-08-25T12:00:00+09:00","lemma":"dominus","canonical_form":"dominus","display_form":"dominus","macronized_form":"dominus","accepted_orthographic_forms":["dominus"],"part_of_speech":"noun","inflection_class":"second-declension-masculine-noun","principal_parts":{"genitive":"dominī"},"gender":"masculine","basic_senses":[{"gloss_ja":"主人、支配者","scope_note":"1Cではdominumとの語尾差だけを観察し、格名は問わない。"}],"introduced_in":"unit-01c","available_from":"unit-01c","register":["classical-prose"],"period":["classical"],"source_refs":[],"evidence":[{"kind":"generated-rationale","claim_scope":"1Cの固定語形","note":"語尾が文法情報に関係することだけを予告するために選定。曲用生成は要求しない。"}],"review":{"draft_status":"ready-for-review","source_checked":[],"editorial_approved":[],"expert_reviewed":[],"automated_validation":[]},"notes":"dominumは未分析の固定比較形。個別辞書項目は未確認。"}
