{"id":"lex-vir","lemma_id":"lex-vir","schema_version":"1.0.0","content_version":"0.1.0","title":"vir","created_at":"2026-08-25T12:00:00+09:00","updated_at":"2026-08-25T12:00:00+09:00","lemma":"vir","canonical_form":"vir","display_form":"vir","macronized_form":"vir","accepted_orthographic_forms":["vir","uir"],"part_of_speech":"noun","inflection_class":"second-declension-er-noun","principal_parts":{"genitive":"virī"},"gender":"masculine","basic_senses":[{"gloss_ja":"男、男性","scope_note":"1Aではv/uの表記差を観察するだけ。"}],"introduced_in":"unit-01a","available_from":"unit-01a","register":["classical-prose"],"period":["classical"],"source_refs":[],"evidence":[{"kind":"generated-rationale","claim_scope":"1Aの表示語","note":"子音u/vの表記差を観察するために選定。形態情報は人間確認待ち。"}],"review":{"draft_status":"ready-for-review","source_checked":[],"editorial_approved":[],"expert_reviewed":[],"automated_validation":[]},"notes":"個別辞書項目は未確認。"}
