{"id":"lex-caesar","lemma_id":"lex-caesar","schema_version":"1.0.0","content_version":"0.1.0","title":"Caesar","created_at":"2026-08-25T12:00:00+09:00","updated_at":"2026-08-25T12:00:00+09:00","lemma":"Caesar","canonical_form":"Caesar","display_form":"Caesar","macronized_form":"Caesar","accepted_orthographic_forms":["Caesar"],"part_of_speech":"noun","inflection_class":"third-declension-proper-noun","principal_parts":{"genitive":"Caesaris"},"gender":"masculine","basic_senses":[{"gloss_ja":"カエサル","scope_note":"人名。1Aではcの音価を観察するだけ。"}],"introduced_in":"unit-01a","available_from":"unit-01a","register":["classical-prose"],"period":["classical"],"source_refs":[],"evidence":[{"kind":"generated-rationale","claim_scope":"1Aの表示語","note":"cの基本音価を観察するために選定。語彙項目の形態情報は人間確認待ち。"}],"review":{"draft_status":"ready-for-review","source_checked":[],"editorial_approved":[],"expert_reviewed":[],"automated_validation":[]},"notes":"固有名詞。個別辞書項目は未確認。"}
