{"id":"lex-terra","lemma_id":"lex-terra","schema_version":"1.0.0","content_version":"0.1.0","title":"terra","created_at":"2026-08-25T12:00:00+09:00","updated_at":"2026-08-25T12:00:00+09:00","lemma":"terra","canonical_form":"terra","display_form":"terra","macronized_form":"terra","accepted_orthographic_forms":["terra"],"part_of_speech":"noun","inflection_class":"first-declension-noun","principal_parts":{"genitive":"terrae"},"gender":"feminine","basic_senses":[{"gloss_ja":"土地、大地","scope_note":"1Bでは音節区切りと位置による長さだけを扱う。"}],"introduced_in":"unit-01b","available_from":"unit-01b","register":["classical-prose"],"period":["classical"],"source_refs":[],"evidence":[{"kind":"generated-rationale","claim_scope":"1Bの表示語","note":"二子音間の音節区切りと位置による長さを観察するために選定。形態情報は人間確認待ち。"}],"review":{"draft_status":"ready-for-review","source_checked":[],"editorial_approved":[],"expert_reviewed":[],"automated_validation":[]},"notes":"個別辞書項目は未確認。"}
