{"id":"lex-roma","lemma_id":"lex-roma","schema_version":"1.0.0","content_version":"0.1.0","title":"Rōma","created_at":"2026-08-25T12:00:00+09:00","updated_at":"2026-08-25T12:00:00+09:00","lemma":"Rōma","canonical_form":"Rōma","display_form":"Rōma","macronized_form":"Rōma","accepted_orthographic_forms":["Rōma","Roma"],"part_of_speech":"noun","inflection_class":"first-declension-proper-noun","principal_parts":{"genitive":"Rōmae"},"gender":"feminine","basic_senses":[{"gloss_ja":"ローマ","scope_note":"都市名。1A～1Bでは読みと音節だけを扱う。"}],"introduced_in":"unit-01a","available_from":"unit-01a","register":["classical-prose"],"period":["classical"],"source_refs":[],"evidence":[{"kind":"generated-rationale","claim_scope":"1A・1Bの表示語","note":"長母音と単純な音節分けを観察するために選定。形態情報は人間確認待ち。"}],"review":{"draft_status":"ready-for-review","source_checked":[],"editorial_approved":[],"expert_reviewed":[],"automated_validation":[]},"notes":"個別辞書項目は未確認。"}
