{"id":"lex-fixture-est","lemma_id":"lex-fixture-est","schema_version":"1.0.0","content_version":"0.1.0","title":"fixture verb","created_at":"2026-08-24T00:00:00+09:00","updated_at":"2026-08-24T00:00:00+09:00","lemma":"sum","canonical_form":"sum","display_form":"sum","macronized_form":null,"accepted_orthographic_forms":["sum"],"part_of_speech":"verb","inflection_class":"irregular","principal_parts":{"first_singular_present":"sum","present_infinitive":"esse"},"gender":null,"basic_senses":[{"gloss_ja":"〜である","scope_note":"fixture用の簡潔な語義"}],"introduced_in":"unit-02a","available_from":"unit-02a","register":["classical-prose"],"period":["classical"],"source_refs":[],"evidence":[{"kind":"generated-rationale","claim_scope":"fixture structure","note":"本番語彙ではない。"}],"review":{"draft_status":"draft","source_checked":[],"editorial_approved":[],"expert_reviewed":[],"automated_validation":[]},"notes":"fixture only"}
