{"id":"lex-ius","lemma_id":"lex-ius","schema_version":"1.0.0","content_version":"0.1.0","title":"iūs","created_at":"2026-08-25T12:00:00+09:00","updated_at":"2026-08-25T12:00:00+09:00","lemma":"iūs","canonical_form":"iūs","display_form":"iūs","macronized_form":"iūs","accepted_orthographic_forms":["iūs","ius","jūs","jus"],"part_of_speech":"noun","inflection_class":"third-declension-neuter","principal_parts":{"genitive":"iūris"},"gender":"neuter","basic_senses":[{"gloss_ja":"法、権利","scope_note":"1Aではi/j表記と長母音表示を観察するだけ。"}],"introduced_in":"unit-01a","available_from":"unit-01a","register":["classical-prose"],"period":["classical"],"source_refs":[],"evidence":[{"kind":"generated-rationale","claim_scope":"1Aの表示語","note":"i/j表記と長母音記号を予告的に観察するために選定。形態情報は人間確認待ち。"}],"review":{"draft_status":"ready-for-review","source_checked":[],"editorial_approved":[],"expert_reviewed":[],"automated_validation":[]},"notes":"長母音の採点は1Bから。個別辞書項目は未確認。"}
