{"id":"lex-amicus","lemma_id":"lex-amicus","schema_version":"1.0.0","content_version":"0.1.0","title":"amīcus","created_at":"2026-08-25T12:00:00+09:00","updated_at":"2026-08-25T12:00:00+09:00","lemma":"amīcus","canonical_form":"amīcus","display_form":"amīcus","macronized_form":"amīcus","accepted_orthographic_forms":["amīcus","amicus"],"part_of_speech":"noun","inflection_class":"second-declension-masculine-noun","principal_parts":{"genitive":"amīcī"},"gender":"masculine","basic_senses":[{"gloss_ja":"友人","scope_note":"1Cではアクセント位置だけを扱う。"}],"introduced_in":"unit-01c","available_from":"unit-01c","register":["classical-prose"],"period":["classical"],"source_refs":[],"evidence":[{"kind":"generated-rationale","claim_scope":"1Cの表示語","note":"長いペヌルティマを持つ三音節語として選定。形態情報は人間確認待ち。"}],"review":{"draft_status":"ready-for-review","source_checked":[],"editorial_approved":[],"expert_reviewed":[],"automated_validation":[]},"notes":"個別辞書項目は未確認。"}
